{
    "$schema": "http://json-schema.org/draft-07/schema#",
    "type": "object",
    "additionalProperties": false,
    "required": [
        "id",
        "amount",
        "transaction_date",
        "source_account",
        "destination_account",
        "source"
    ],
    "properties": {
        "id": {
            "type": "string",
            "minLength": 1,
            "maxLength": 100
        },
        "amount": {
            "type": "integer",
            "minimum": 1
        },
        "transaction_date": {
            "type": "string",
            "pattern": "^\\d{4}-\\d{2}-\\d{2}T\\d{2}:\\d{2}:\\d{2}(\\.\\d+)?(Z|[+-]\\d{2}:\\d{2})$"
        },
        "source_account": {
            "type": "object",
            "additionalProperties": false,
            "required": [
                "branch",
                "account_number",
                "opening_date",
                "owner"
            ],
            "properties": {
                "branch": {
                    "type": "string",
                    "pattern": "^\\d{1,10}$"
                },
                "account_number": {
                    "type": "string",
                    "pattern": "^\\d{1,20}$"
                },
                "opening_date": {
                    "type": "string",
                    "pattern": "^\\d{4}-\\d{2}-\\d{2}T\\d{2}:\\d{2}:\\d{2}(\\.\\d+)?(Z|[+-]\\d{2}:\\d{2})$"
                },
                "owner": {
                    "type": "object",
                    "additionalProperties": false,
                    "required": [
                        "document_number"
                    ],
                    "properties": {
                        "document_number": {
                            "type": "string",
                            "pattern": "^(\\d{3}\\.\\d{3}\\.\\d{3}-\\d{2}|\\d{2}\\.\\d{3}\\.\\d{3}/\\d{4}-\\d{2})$"
                        }
                    }
                }
            }
        },
        "destination_account": {
            "type": "object",
            "additionalProperties": false,
            "required": [
                "participant",
                "branch",
                "account_number",
                "opening_date",
                "owner"
            ],
            "properties": {
                "participant": {
                    "type": "string",
                    "pattern": "^\\d{8}$"
                },
                "branch": {
                    "type": "string",
                    "pattern": "^\\d{1,10}$"
                },
                "account_number": {
                    "type": "string",
                    "pattern": "^\\d{1,20}$"
                },
                "opening_date": {
                    "type": "string",
                    "pattern": "^\\d{4}-\\d{2}-\\d{2}T\\d{2}:\\d{2}:\\d{2}(\\.\\d+)?(Z|[+-]\\d{2}:\\d{2})$"
                },
                "owner": {
                    "type": "object",
                    "additionalProperties": false,
                    "required": [
                        "document_number"
                    ],
                    "properties": {
                        "document_number": {
                            "type": "string",
                            "pattern": "^(\\d{3}\\.\\d{3}\\.\\d{3}-\\d{2}|\\d{2}\\.\\d{3}\\.\\d{3}/\\d{4}-\\d{2})$"
                        }
                    }
                }
            }
        },
        "source": {
            "type": "object",
            "additionalProperties": false,
            "required": [
                "device_id",
                "channel",
                "ip"
            ],
            "properties": {
                "device_id": {
                    "type": "string",
                    "minLength": 1,
                    "maxLength": 100
                },
                "channel": {
                    "type": "string",
                    "minLength": 1,
                    "maxLength": 30
                },
                "ip": {
                    "type": "string",
                    "pattern": "^([0-9]{1,3}(\\.[0-9]{1,3}){3}|[0-9a-fA-F:]+:[0-9a-fA-F:]*)$"
                },
                "geolocation": {
                    "type": "object",
                    "additionalProperties": false,
                    "required": [
                        "latitude",
                        "longitude"
                    ],
                    "properties": {
                        "latitude": {
                            "type": "number",
                            "minimum": -90,
                            "maximum": 90
                        },
                        "longitude": {
                            "type": "number",
                            "minimum": -180,
                            "maximum": 180
                        }
                    }
                }
            }
        }
    }
}
