{
  "id": "pix-000123",
  "amount": 150000,
  "transaction_date": "2026-10-17T22:15:00-03:00",
  "source_account": {
    "branch": "0001",
    "account_number": "88213",
    "opening_date": "2025-03-02T10:00:00-03:00",
    "owner": { "document_number": "123.456.789-09" }
  },
  "destination_account": {
    "participant": "60701190",
    "branch": "3675",
    "account_number": "10442",
    "opening_date": "2026-10-10T09:00:00-03:00",
    "owner": { "document_number": "987.654.321-00" }
  },
  "source": {
    "device_id": "dvc-9f2c71a8",
    "channel": "app",
    "ip": "198.51.100.23",
    "geolocation": { "latitude": -23.56, "longitude": -46.65 }
  }
}
